{
  "$schema": "https://json-schema.org/draft/2020-12/schema",
  "$id": "https://bonsaibauer.github.io/shroudforge/schemas/extended.mod.schema.json",
  "title": "ShroudForge mod extension",
  "type": "object",
  "additionalProperties": false,
  "required": ["schemaVersion", "enabled"],
  "properties": {
    "$schema": { "type": "string" },
    "schemaVersion": { "const": 1 },
    "enabled": { "type": "boolean" },
    "targets": {
      "description": "Processes this mod runs in. Legacy EML packages without targets default to client and server. ShroudForge packages default to client.",
      "type": "array",
      "minItems": 1,
      "uniqueItems": true,
      "items": { "enum": ["client", "server"] }
    },
    "launcher": {
      "description": "Launcher that originally identified this mod. Omit for ShroudForge mods. Use EML to preserve EML provenance.",
      "enum": ["EML", "SF"]
    },
    "links": {
      "type": "object",
      "propertyNames": { "pattern": "^[a-z][a-z0-9-]*$" },
      "additionalProperties": { "type": "string", "pattern": "^https://", "maxLength": 2048 }
    },
    "changelog": {
      "type": "array",
      "maxItems": 50,
      "items": { "type": "string", "minLength": 1, "maxLength": 500 }
    },
    "settings": {
      "type": "object",
      "propertyNames": { "pattern": "^[A-Za-z0-9._-]{1,80}$" },
      "additionalProperties": {
        "oneOf": [
          { "type": ["boolean", "string", "number", "array"] },
          { "$ref": "#/$defs/setting" }
        ]
      }
    },
    "groups": {
      "type": "array",
      "items": { "$ref": "#/$defs/group" }
    }
  },
  "$defs": {
    "setting": {
      "type": "object",
      "additionalProperties": false,
      "required": ["value"],
      "properties": {
        "value": { "type": ["boolean", "string", "number", "array"] },
        "label": { "type": "string", "minLength": 1, "maxLength": 120 },
        "description": { "type": "string", "maxLength": 500 },
        "control": { "enum": ["toggle", "checkbox", "text", "textarea", "number", "slider", "select", "radio", "segmented", "multiselect", "keybind", "color"] },
        "applyAt": { "enum": ["live", "restart"] },
        "restartRequired": { "type": "boolean" },
        "assetPreparation": { "type": "boolean" },
        "enabledWhen": {
          "type": "object",
          "additionalProperties": false,
          "required": ["setting", "equals"],
          "properties": {
            "setting": { "type": "string", "pattern": "^[A-Za-z0-9._-]{1,80}$" },
            "equals": { "type": ["boolean", "string", "number"] }
          }
        },
        "min": { "type": "number" },
        "max": { "type": "number" },
        "step": { "type": "number", "exclusiveMinimum": 0 },
        "minLength": { "type": "integer", "minimum": 0 },
        "maxLength": { "type": "integer", "minimum": 0 },
        "options": {
          "type": "object",
          "minProperties": 1,
          "additionalProperties": { "type": "string", "minLength": 1, "maxLength": 120 }
        }
      },
      "allOf": [
        {
          "if": { "required": ["control"], "properties": { "control": { "const": "keybind" } } },
          "then": {
            "properties": {
              "value": {
                "type": "string",
                "maxLength": 96,
                "description": "One shortcut string containing an SDL keyboard chord, a Mouse button chord, or keyboard|mouse alternatives. Each chord supports ordered Ctrl, Alt, Shift and Meta prefixes. Empty disables the shortcut.",
                "pattern": "^(?:(?:Ctrl\\+)?(?:Alt\\+)?(?:Shift\\+)?(?:Meta\\+)?SDL:[1-9][0-9]{0,2}(?:\\|(?:Ctrl\\+)?(?:Alt\\+)?(?:Shift\\+)?(?:Meta\\+)?Mouse:[1-9][0-9]?)?|(?:Ctrl\\+)?(?:Alt\\+)?(?:Shift\\+)?(?:Meta\\+)?Mouse:[1-9][0-9]?)?$"
              }
            }
          }
        }
      ]
    },
    "action": {
      "type": "object",
      "additionalProperties": false,
      "required": ["id", "label"],
      "properties": {
        "id": { "type": "string", "pattern": "^[A-Za-z0-9._-]{1,80}$" },
        "label": { "type": "string", "minLength": 1, "maxLength": 120 },
        "style": { "enum": ["primary", "secondary", "danger"] },
        "confirm": { "type": "string", "maxLength": 500 }
      }
    },
    "group": {
      "type": "object",
      "additionalProperties": false,
      "required": ["label"],
      "properties": {
        "label": { "type": "string", "minLength": 1, "maxLength": 120 },
        "description": { "type": "string", "maxLength": 500 },
        "settings": {
          "type": "array",
          "uniqueItems": true,
          "items": { "type": "string", "pattern": "^[A-Za-z0-9._-]{1,80}$" }
        },
        "actions": { "type": "array", "items": { "$ref": "#/$defs/action" } }
      }
    }
  }
}
