{
  "$schema": "https://bonsaibauer.github.io/shroudforge/schemas/extended.mod.schema.json",
  "schemaVersion": 1,
  "enabled": true,
  "targets": [
    "client",
    "server"
  ],
  "links": {
    "source-github": "https://github.com/bonsaibauer/shroudforge",
    "issues": "https://github.com/bonsaibauer/shroudforge/issues/new?template=bug_report.yml",
    "support-bmac": "https://buymeacoffee.com/bonsaibauer"
  },
  "changelog": [
    "Refills original Stamina roots through typed ECS queries and guarded attribute updates. Waits for the world without a native modifier patch."
  ],
  "settings": {
    "autoRefill": true
  },
  "groups": [
    {
      "label": "Stamina behavior",
      "description": "Repeatedly refills stamina to maximum.",
      "settings": [
        "autoRefill"
      ]
    }
  ]
}
