{
  "$schema": "https://bonsaibauer.github.io/shroudforge/schemas/extended.mod.schema.json",
  "schemaVersion": 1,
  "enabled": false,
  "targets": ["client"],
  "launcher": "SF",
  "links": {
    "source-github": "https://github.com/Tellik/enshrouded-autorun"
  },
  "settings": {
    "toggleAutorun": {
      "value": "SDL:65",
      "control": "keybind",
      "label": "Toggle autorun",
      "description": "F8 by default. Press again to stop.",
      "applyAt": "live"
    },
    "cancelAutorun": {
      "value": "SDL:22",
      "control": "keybind",
      "label": "Cancel autorun",
      "description": "S by default. Match this to your backward movement key.",
      "applyAt": "live"
    }
  },
  "groups": [
    {
      "label": "Autorun",
      "description": "F8 toggles normal forward movement. Backward input cancels it.",
      "settings": ["toggleAutorun", "cancelAutorun"]
    }
  ]
}
