{
  "$schema": "https://bonsaibauer.github.io/shroudforge/schemas/extended.mod.schema.json",
  "schemaVersion": 1,
  "enabled": true,
  "targets": [
    "client",
    "server"
  ],
  "links": {
    "source-github": "https://github.com/bonsaibauer/shroudforge",
    "issues": "https://github.com/bonsaibauer/shroudforge/issues/new?template=bug_report.yml",
    "support-bmac": "https://buymeacoffee.com/bonsaibauer"
  },
  "changelog": [
    "Adds eight Survival settings through the shared typed runtime API, original attribute bounds, player-template configuration and the engine durability setting."
  ],
  "settings": {
    "noFallDamage": {
      "value": false,
      "label": "No Fall Damage",
      "description": "Disables fall damage through the original fall configuration. Players using the same player template share this effect."
    },
    "fastHealthRegen": {
      "value": false,
      "label": "Fast Health Regen",
      "description": "Increases the existing health recharge value in the original attribute by up to 100 times. This setting has no effect without natural regeneration."
    },
    "fastManaRegen": {
      "value": false,
      "label": "Fast Mana Regen",
      "description": "Increases the existing mana recharge value in the original attribute by up to 100 times. This setting has no effect without natural regeneration."
    },
    "infiniteStamina": {
      "value": false,
      "label": "Infinite Stamina",
      "description": "Keeps stamina at its current maximum through the original attribute lower bound. Changes to the maximum are applied automatically."
    },
    "infiniteUnderwaterBreath": {
      "value": false,
      "label": "Infinite Underwater Breath",
      "description": "Keeps the underwater breath reserve at its current maximum through the original attribute lower bound."
    },
    "infiniteWeaponDurability": {
      "value": false,
      "label": "Infinite Weapon Durability",
      "description": "Disables durability loss for the entire hosted world, including items equipped by other players. Restores the previous world setting when disabled."
    },
    "infiniteFrostTimer": {
      "value": false,
      "label": "Infinite Frost Timer",
      "description": "Keeps body warmth at its current maximum through the original attribute lower bound."
    },
    "infiniteMana": {
      "value": false,
      "label": "Infinite Mana",
      "description": "Keeps mana at its current maximum through the original attribute lower bound. Changes to the maximum are applied automatically."
    }
  },
  "groups": [
    {
      "label": "Survival",
      "description": "Enables individual survival features. Changes to settings are saved immediately.",
      "settings": [
        "noFallDamage",
        "fastHealthRegen",
        "fastManaRegen",
        "infiniteStamina",
        "infiniteUnderwaterBreath",
        "infiniteWeaponDurability",
        "infiniteFrostTimer",
        "infiniteMana"
      ]
    }
  ]
}
