{
  "$schema": "https://bonsaibauer.github.io/shroudforge/schemas/extended.mod.schema.json",
  "schemaVersion": 1,
  "enabled": true,
  "targets": [
    "client",
    "server"
  ],
  "links": {
    "source-github": "https://github.com/bonsaibauer/shroudforge",
    "issues": "https://github.com/bonsaibauer/shroudforge/issues/new?template=bug_report.yml",
    "support-bmac": "https://buymeacoffee.com/bonsaibauer"
  },
  "changelog": [
    "Uses the actual player-template FallDamage configuration through reflected resource scalar updates, with readback and guarded restoration."
  ],
  "groups": [
    {
      "label": "No Fall Damage",
      "description": "Uses the original player-template fall configuration. Players sharing that template share the effect.",
      "actions": [
        {
          "id": "toggleFallDamagePatch",
          "label": "Toggle fall-damage protection",
          "style": "secondary"
        }
      ]
    }
  ]
}
