{
  "$schema": "https://bonsaibauer.github.io/shroudforge/schemas/extended.mod.schema.json",
  "schemaVersion": 1,
  "enabled": true,
  "targets": ["client", "server"],
  "settings": {
    "noResourceCost": {
      "value": true,
      "label": "No Recipe Resource Costs",
      "description": "Removes direct ingredients, category ingredients and water charges from recipes before startup. Recipe requirements display as zero. Requires a game restart. Building, upgrade and other shared inventory costs are unchanged.",
      "control": "checkbox",
      "applyAt": "restart",
      "restartRequired": true,
      "assetPreparation": true
    },
    "infiniteItemUse": {
      "value": true,
      "label": "No Item Consumption",
      "description": "Used food, potions, bandages and other supported items stay in your inventory instead of being consumed. Applies live to supported use actions. Recipe ingredients, trades and inventory transfers are unchanged. Some item actions are not supported.",
      "control": "checkbox",
      "applyAt": "live",
      "restartRequired": false
    },
    "productionTimeMode": {
      "value": "original",
      "label": "Recipe Time Mode",
      "description": "Changing the mode requires a restart. Original recipe times use the live scale. Shared time changes every timed recipe during startup asset preparation.",
      "control": "select",
      "options": {
        "original": "Live: Original recipe times",
        "fixed": "Restart required: One shared time for all recipes"
      },
      "applyAt": "restart",
      "restartRequired": true,
      "assetPreparation": true
    },
    "productionSeconds": {
      "value": 3,
      "label": "Production Time in Seconds",
      "description": "Sets one base duration for every timed recipe in shared-time mode. Applied during startup asset preparation. Requires restart.",
      "control": "slider",
      "min": 1,
      "max": 900,
      "step": 1,
      "enabledWhen": {
        "setting": "productionTimeMode",
        "equals": "fixed"
      },
      "applyAt": "restart",
      "restartRequired": true,
      "assetPreparation": true
    },
    "workshopTimeFactorPercent": {
      "value": 100,
      "label": "Production Duration Scale",
      "description": "Applied live to loaded recipe times. At 0%, the shortest timed recipe takes 1 second and other recipes keep their relative times. 100% restores original recipe times. The world speed setting stays unchanged. Changes also affect running production.",
      "control": "slider",
      "min": 0,
      "max": 100,
      "step": 5,
      "enabledWhen": {
        "setting": "productionTimeMode",
        "equals": "original"
      },
      "applyAt": "live",
      "restartRequired": false
    }
  },
  "groups": [
    {
      "label": "Resources and Inventory",
      "description": "Recipe ingredient and water costs are removed before startup. No Item Consumption prevents supported items from being consumed when used.",
      "settings": ["noResourceCost", "infiniteItemUse"]
    },
    {
      "label": "Production",
      "description": "Choose live scaling of original recipe times or one shared duration prepared at startup. Only the control for the selected mode is enabled.",
      "settings": ["productionTimeMode", "productionSeconds", "workshopTimeFactorPercent"]
    }
  ]
}
