{
  "$schema": "https://bonsaibauer.github.io/shroudforge/schemas/extended.mod.schema.json",
  "schemaVersion": 1,
  "enabled": true,
  "targets": [
    "client",
    "server"
  ],
  "links": {
    "source-github": "https://github.com/bonsaibauer/shroudforge",
    "issues": "https://github.com/bonsaibauer/shroudforge/issues/new?template=bug_report.yml",
    "support-bmac": "https://buymeacoffee.com/bonsaibauer"
  },
  "changelog": [
    "Uses the shared typed runtime API for a native pitch-rate controller, glider stamina and four ItemInfo controls. Independent mod with automatic API restoration. Upward tilt is prepared for live verification in pitch-speed input mode."
  ],
  "settings": {
    "unlimitedFlying": {
      "value": false,
      "label": "Unlimited Flying",
      "description": "Allows upward glider tilt without glider stamina drain. Requires pitch-speed controls and one player in the authoritative world. The sampled upward control must be verified in the live game.",
      "control": "checkbox"
    },
    "turnSpeed": {
      "value": 100,
      "label": "Turn Speed",
      "description": "Multiplier for the original glider yaw rate. 100% keeps the item value.",
      "control": "slider",
      "min": 25,
      "max": 400,
      "step": 5
    },
    "moveSpeed": {
      "value": 100,
      "label": "Move Speed",
      "description": "Multiplier for the original forward acceleration coefficient. 100% keeps the item value.",
      "control": "slider",
      "min": 25,
      "max": 400,
      "step": 5
    },
    "liftSpeed": {
      "value": 100,
      "label": "Lift Speed",
      "description": "Multiplier for the original longitudinal air resistance. This field is a drag coefficient, so higher values increase resistance.",
      "control": "slider",
      "min": 25,
      "max": 400,
      "step": 5
    },
    "descendSpeed": {
      "value": 100,
      "label": "Descend Speed",
      "description": "Multiplier for the original vertical air resistance. This field is a drag coefficient, so higher values increase resistance.",
      "control": "slider",
      "min": 25,
      "max": 400,
      "step": 5
    }
  },
  "groups": [
    {
      "label": "Unlimited Flight",
      "description": "Uses the active glider's original controls. ItemInfo settings are shared by every user of the same glider type. Speed sliders apply once that glider is used.",
      "settings": [
        "unlimitedFlying",
        "turnSpeed",
        "moveSpeed",
        "liftSpeed",
        "descendSpeed"
      ]
    }
  ]
}
